EKR000389642018,,,Felsőörs község Önkormányzata,15734116219,Nem,Nem,N - Regionális/helyi szintű,KL - Általános közszolgáltatások,Nemzeti eljárásrend,Kbt. 115. § Hirdetmény nélküli tárgyalásos eljárás,Miske és Király utca építése Felsőörs településen,Építési beruházás,62756464.0,HUF,45233120-6,45316110-9|45232450-1|45232451-8,HU213,Igen,Nem,Igen,Nem,Igen,,2018-09-17,3.0,Nem,Colas Út Építőipari Zártkörűen Működő Részvénytársaság,"14904134244,HU14904134",HUN_1113_Budapest_Bocskai Út 73. ,Nem,,HUF,62756464.0,HUF,Igen,nem ismert,,Nem,Nem,Nincs adat,17141/2018,,2018-09-24,Tájékoztató az eljárás eredményéről,-7 days,42931,Felsőörs község Önkormányzata,Colas Út Építőipari Zártkörűen Működő Részvénytársaság
EKR001097522019,,,Országos Kórházi Főigazgatóság|Debreceni Egyetem,15845883243|15329750409,Igen,Nem,"U - Minisztériumi vagy egyéb nemzeti vagy szövetségi hatóság, valamint regionális vagy helyi részlegeik",KL - Egészségügy,Uniós eljárásrend,Nyílt eljárás,"DE Gyermekpszichiátriai ép. átal., szakr.ép. felúj",Építési beruházás,511182243.0,HUF,45000000-7,45350000-5|45315100-9|45300000-0|45262700-8|45262690-4,HU321,Igen,Nem,Igen,Igen,Igen,,2020-07-06,5.0,Nem,TÖMB 2002 Szolgáltató Korlátolt Felelősségű Társaság,"22757937209,HU22757937",HUN_4220_Hajdúböszörmény_Polgári  Utca 13.,Igen,443416011.0,HUF,511182243.0,HUF,Igen,"ARA-Terv Ipari és Szolgáltató Bt., adó: 22872339-1-09, CS-Control Építőipari Kereskedelmi és Szolgáltató Kft., adó: 23849325-2-09, Zs-Tervezőiroda Kft. adó: 26350037-2-09","ARA-Terv Ipari és Szolgáltató Bt., adó: 22872339-1-09,  III.1.3) M.2.a követelmény; CS-Control Építőipari Kereskedelmi és Szolgáltató Kft., adó: 23849325-2-09, III.1.3) M.2.b; Zs-Tervezőiroda Kft. adó: 26350037-2-09, III.1.3) M.2.c",Nem,Nem,Nincs adat,12392/2020,2020/S 138-338511,2020-07-22,Tájékoztató az eljárás eredményéről,-16 days,43027,Országos Kórházi Főigazgatóság|Debreceni Egyetem,TÖMB 2002 Szolgáltató Korlátolt Felelősségű Társaság
EKR000060062018,,,Debreceni Egyetem,15329750409,Nem,Nem,U - Egyéb típus:,KL - Oktatás,Nemzeti eljárásrend,Kbt. 115. § Nyílt eljárás,DEK-587_A DE étterme szellőzőjének átalakítása,Építési beruházás,53210687.0,HUF,45000000-7,42500000-1|45000000-7,HU321,Igen,Nem,Igen,Nem,Igen,,2018-07-31,4.0,Nem,TÖMB 2002 Szolgáltató Korlátolt Felelősségű Társaság,"22757937209,HU22757937",HUN_4220_Hajdúböszörmény_Désány István Utca 16. IV/15. ,Igen,54318338.0,HUF,53210687.0,HUF,Nem,,-,Nem,Nem,Nincs adat,14743/2018,,2018-08-26,Tájékoztató az eljárás eredményéről,-26 days,43275,Debreceni Egyetem,TÖMB 2002 Szolgáltató Korlátolt Felelősségű Társaság
EKR001125722019,,,Csopak község Önkormányzata,15734051219,Nem,Nem,N - Regionális/helyi szintű,KL - Általános közszolgáltatások,Nemzeti eljárásrend,Kbt. 115. § Nyílt eljárás,Csopak 1030/3 hrsz-ú Csalló köz felújítás,Építési beruházás,4041598.0,HUF,45233142-6,45233142-6,HU213,Igen,Nem,Igen,Nem,Igen,,2019-10-09,2.0,Nem,Colas Út Építőipari Zártkörűen Működő Részvénytársaság,"14904134244,HU14904134",HUN_1113_Budapest_Bocskai Út 73.,Nem,,HUF,4041598.0,HUF,Igen, ajánlatadáskor még nem ismrt,,Nem,Nem,Nincs adat,20537/2019,,2019-10-21,Tájékoztató az eljárás eredményéről,-12 days,43367,Csopak község Önkormányzata,Colas Út Építőipari Zártkörűen Működő Részvénytársaság
EKR001135352019,,,Balatonakarattya Község Önkormányzata,15827014219,Nem,Nem,N - Regionális/helyi szintű,KL - Általános közszolgáltatások,Nemzeti eljárásrend,Kbt. 115. § Hirdetmény nélküli tárgyalásos eljárás,Állomás utca és környéke kiépítés - útépítés,Építési beruházás,44930991.0,HUF,45233120-6,45233120-6,HU213,Igen,Nem,Igen,Nem,Igen,,2019-10-08,2.0,Nem,Colas Út Építőipari Zártkörűen Működő Részvénytársaság,"14904134244,HU14904134",HUN_1113_Budapest_Bocskai Út 73.,Nem,47908250.0,HUF,44930991.0,HUF,Igen,Az ajánlattételkor nem ismertek. (a V.2.9. rovatban az összes részterület a karakterkorlátra figyelemmel nem került feltüntetésre.),,Nem,Nem,Nincs adat,20873/2019,,2019-10-24,Tájékoztató az eljárás eredményéről,-16 days,43420,Balatonakarattya Község Önkormányzata,Colas Út Építőipari Zártkörűen Működő Részvénytársaság
EKR001148732019,,,Fővárosi Csatornázási Művek Zrt.,10893850244,Nem,Nem,N - Közjogi szervezet,KL - Egyéb tevékenység:,Nemzeti eljárásrend,Kbt. 115. § Hirdetmény nélküli tárgyalásos eljárás,Pannónia utcai csatornarekonstrukció,Építési beruházás,83976167.0,HUF,45232400-6,45233223-8|45232423-3|45232400-6|45232410-9,HU110,Igen,Nem,Igen,Nem,Igen,,2019-12-16,2.0,Nem,Penta Általános Építőipari Korlátolt Felelősségű Társaság,"10452556244,HU10452556",HUN_2100_Gödöllő_Kenyérgyári Út 1/E.,Igen,50000000.0,HUF,83976167.0,HUF,Igen,Ajánlattételkor nem ismert!,,Nem,Nem,Nincs adat,24543/2019,,2019-12-22,Tájékoztató az eljárás eredményéről,-6 days,43547,Fővárosi Csatornázási Művek Zrt.,Penta Általános Építőipari Korlátolt Felelősségű Társaság
EKR001193352019,,,Hajdúböszörmény Város Önkormányzata,15728331209,Nem,Nem,N - Regionális/helyi szintű,KL - Általános közszolgáltatások,Nemzeti eljárásrend,Kbt. 117. § Saját beszerzési szabályok alkalmazása részvételi szakasz nélkül,Többfunkciós terem kialakítása,Építési beruházás,58142030.0,HUF,45210000-2,45442100-8|45432113-9|45432220-2|45262522-6|45310000-3|45314300-4|45311000-0|45111100-9|45331200-8|45320000-6|45421131-1|45324000-4,HU321,Igen,Nem,Igen,Nem,Igen,,2019-11-08,3.0,Nem,TÖMB 2002 Szolgáltató Korlátolt Felelősségű Társaság,"22757937209,HU22757937",HUN_4220_Hajdúböszörmény_Polgári  Utca 13.,Igen,58155648.0,HUF,58142030.0,HUF,Igen,"Ara-Terv Bt. (adószáma: 22872339-1-09), CS-Control Kft. (adószáma: 23849325-2-09), Hajdúsági Hulladékgazdálkodási Nonprofit Kft. (adószáma: 13321134-2-09)",,Nem,Nem,Nincs adat,21932/2019,,2019-11-26,Tájékoztató az eljárás eredményéről,-18 days,43909,Hajdúböszörmény Város Önkormányzata,TÖMB 2002 Szolgáltató Korlátolt Felelősségű Társaság
EKR001237922019,,,Győr Megyei Jogú Város Önkormányzata,15735595208,Nem,Nem,N - Regionális/helyi szintű,KL - Általános közszolgáltatások,Nemzeti eljárásrend,Kbt. 115. § Nyílt eljárás,II. János Pál tér – régészeti előkészítő munkák,Építési beruházás,211516800.0,HUF,45111291-4,45112000-5|45111291-4,HU221,Igen,Nem,Igen,Nem,Igen,,2019-12-12,3.0,Nem,STRABAG Általános Építő Korlátolt Felelősségű Társaság,"11705053444,01-09-930940",HUN_1117_Budapest_Gábor Dénes (Infopark D épület) Utca 2. ,Nem,193812933.0,HUF,211516800.0,HUF,Igen,Nem ismert,,Nem,Nem,Nincs adat,24474/2019,,2019-12-18,Tájékoztató az eljárás eredményéről,-6 days,44229,Győr Megyei Jogú Város Önkormányzata,STRABAG Általános Építő Korlátolt Felelősségű Társaság
EKR001353222019,,,NIF Nemzeti Infrastruktúra Fejlesztő zártkörűen működő Részvénytársaság,11906522241,Nem,Nem,U - Közjogi intézmény,KL - Egyéb tevékenység:,Uniós eljárásrend,Nyílt eljárás,Bp-Etyek kerékpárút építés: biatorbágyi szakasz,Építési beruházás,294929240.0,HUF,45233162-2,45233162-2,HU120,Igen,Nem,Igen,Nem,Igen,,2020-09-22,8.0,Nem,Colas Út Építőipari Zártkörűen Működő Részvénytársaság,"14904134244,HU14904134",HUN_1113_Budapest_Bocskai Út 73.,Nem,342377312.0,HUF,294929240.0,HUF,Igen,,nem releváns,Nem,Nem,Nincs adat,18404/2020,2020/S 202-487358,2020-10-15,Tájékoztató az eljárás eredményéről,-23 days,45014,NIF Nemzeti Infrastruktúra Fejlesztő zártkörűen működő Részvénytársaság,Colas Út Építőipari Zártkörűen Működő Részvénytársaság
EKR001445882019,,,Bicske Város Önkormányzata,15727048207,Nem,Nem,N - Regionális/helyi szintű,KL - Általános közszolgáltatások,Nemzeti eljárásrend,Kbt. 115. § Nyílt eljárás,Thököly járda,Építési beruházás,44264844.0,HUF,45000000-7,45112100-6|45213316-1|45232452-5,HU211,Igen,Nem,Igen,Nem,Igen,,2020-02-27,3.0,Nem,ÚTÉPPARK Útépítő és Mélyépítő Kft.,"24105099207,24105099",HUN_8000_Székesfehérvár_Szlovák Utca 6,Igen,47704488.0,HUF,44264844.0,HUF,Igen,nem ismert,,Nem,Nem,Nincs adat,3799/2020,,2020-03-04,Tájékoztató az eljárás eredményéről,-6 days,45643,Bicske Város Önkormányzata,ÚTÉPPARK Útépítő és Mélyépítő Kft.
EKR001455342019,,,Mátraalja Térségfejlesztő Nonprofit Kft,25132395212,Nem,Nem,N - Közjogi szervezet,KL - Egyéb tevékenység:,Nemzeti eljárásrend,Kbt. 117. § Saját beszerzési szabályok alkalmazása részvételi szakasz nélkül,Bátonyterenye-Ipari park bővítése,Építési beruházás,1241416519.0,HUF,45000000-7,71320000-7|45100000-8|45110000-1|45111290-7|45231300-8|45233226-9,HU313,Igen,Nem,Igen,Igen,Igen,,2020-04-07,3.0,Nem,Penta Általános Építőipari Korlátolt Felelősségű Társaság,"10452556244,HU10452556",HUN_2100_Gödöllő_Kenyérgyári Út 1/E.,Igen,965749857.0,HUF,1241416519.0,HUF,Igen,Tarjánvölgyi Kft.  23382226-2-12.,Tarjánvölgyi Kft.  23382226-2-12. MSZ1.: 1db 2 forgalmi sávos közúti híd építése élő vízfolyás fölött,Nem,Nem,Nincs adat,6454/2020,,2020-04-13,Tájékoztató az eljárás eredményéről,-6 days,45733,Mátraalja Térségfejlesztő Nonprofit Kft,Penta Általános Építőipari Korlátolt Felelősségű Társaság
EKR001461712019,,,Környe Község Önkormányzata,15729961211,Nem,Nem,N - Regionális/helyi szintű,KL - Általános közszolgáltatások,Nemzeti eljárásrend,Kbt. 115. § Nyílt eljárás,Külterületi út felújítása,Építési beruházás,54647969.0,HUF,45000000-7,45247112-8|45233228-3|45110000-1|45111200-0|45112200-7,HU212,Igen,Nem,Igen,Igen,Igen,,2020-03-11,4.0,Nem,Colas Út Építőipari Zártkörűen Működő Részvénytársaság,"14904134244,HU14904134",HUN_1113_Budapest_Bocskai Út 73.,Nem,59750230.0,HUF,54647969.0,HUF,Igen,nem ismert,,Nem,Nem,Nincs adat,4617/2020,,2020-03-15,Tájékoztató az eljárás eredményéről,-4 days,45803,Környe Község Önkormányzata,Colas Út Építőipari Zártkörűen Működő Részvénytársaság
EKR001467552019,,,Zalaegerszeg Megyei Jogú Város Önkormányzata,15734453220,Nem,Nem,U - Közjogi intézmény,KL - Egyéb tevékenység:,Uniós eljárásrend,Nyílt eljárás,Kispáli összekötő út felújítási munkái,Építési beruházás,178568438.0,HUF,45233120-6,45233140-2|45233120-6|45233200-1|45233223-8|45233220-7|45233294-6|45233320-8|45233221-4|45233228-3,HU223,Igen,Nem,Igen,Igen,Igen,,2020-04-24,4.0,Nem,Colas Út Építőipari Zártkörűen Működő Részvénytársaság,"14904134244,HU14904134",HUN_1113_Budapest_Bocskai Út 73.,Nem,,HUF,178568438.0,HUF,Igen,Nem ismert,,Nem,Nem,Nincs adat,7539/2020,2020/S 085-200408,2020-05-05,Tájékoztató az eljárás eredményéről,-11 days,45831,Zalaegerszeg Megyei Jogú Város Önkormányzata,Colas Út Építőipari Zártkörűen Működő Részvénytársaság
EKR001502532019,,,Békés Megyei Hajnal István Szociális Szolgáltató Centrum,15343226204,Nem,Nem,N - Regionális/helyi szintű,KL - Szociális védelem,Nemzeti eljárásrend,Kbt. 115. § Nyílt eljárás,Autista ház - Virág utcai új épület építése,Építési beruházás,34079594.0,HUF,45000000-7,45000000-7,HU332,Igen,Nem,Igen,Nem,Igen,,2019-12-17,3.0,Nem,TÖMB 2002 Szolgáltató Korlátolt Felelősségű Társaság,"22757937209,HU22757937",HUN_4220_Hajdúböszörmény_Polgári  Utca 13.,Igen,28000000.0,HUF,34079594.0,HUF,Igen,"Ara-Terv Bt. (4031 Debrecen, Ond utca 6.) 22872339-1-09",,Nem,Nem,Nincs adat,24725/2019,,2019-12-19,Tájékoztató az eljárás eredményéről,-2 days,46059,Békés Megyei Hajnal István Szociális Szolgáltató Centrum,TÖMB 2002 Szolgáltató Korlátolt Felelősségű Társaság
EKR001501432019,,,Mór Városi Önkormányzat,15727220207,Nem,Nem,N - Regionális/helyi szintű,KL - Általános közszolgáltatások,Nemzeti eljárásrend,Kbt. 115. § Nyílt eljárás,Vis Maior helyreállítási munkálatok I. ütem,Építési beruházás,39199162.0,HUF,45262620-3,45262620-3|45233142-6,HU211,Igen,Nem,Igen,Nem,Igen,,2020-02-10,3.0,Nem,ÚTÉPPARK Útépítő és Mélyépítő Kft.,"24105099207,24105099",HUN_8000_Székesfehérvár_Szlovák Utca 6,Igen,,HUF,39199162.0,HUF,Nem,,,Nem,Nem,Nincs adat,2554/2020,,2020-02-12,Tájékoztató az eljárás eredményéről,-2 days,46064,Mór Városi Önkormányzat,ÚTÉPPARK Útépítő és Mélyépítő Kft.
EKR001502842019,,,Mór Városi Önkormányzat,15727220207,Nem,Nem,N - Regionális/helyi szintű,KL - Általános közszolgáltatások,Nemzeti eljárásrend,Kbt. 115. § Nyílt eljárás,Útfenntartás 2020. évben,Építési beruházás,34251969.0,HUF,45233142-6,45233142-6,HU211,Igen,Nem,Igen,Nem,Igen,,2020-02-10,2.0,Nem,ÚTÉPPARK Útépítő és Mélyépítő Kft.,"24105099207,24105099",HUN_8000_Székesfehérvár_Szlovák Utca 6,Igen,,HUF,34251969.0,HUF,Igen,Nem ismert az ajánlat benyújtásakor,,Nem,Nem,Nincs adat,2559/2020,,2020-02-12,Tájékoztató az eljárás eredményéről,-2 days,46067,Mór Városi Önkormányzat,ÚTÉPPARK Útépítő és Mélyépítő Kft.
EKR001570472019,,,Mór Városi Önkormányzat,15727220207,Nem,Nem,N - Regionális/helyi szintű,KL - Általános közszolgáltatások,Nemzeti eljárásrend,Kbt. 115. § Nyílt eljárás,Vis Maior helyreállítási munkálatok II. ütem,Építési beruházás,33696228.0,HUF,45262620-3,45262620-3|45233142-6,HU211,Igen,Nem,Igen,Nem,Igen,,2020-02-27,3.0,Nem,ÚTÉPPARK Útépítő és Mélyépítő Kft.,"24105099207,24105099",HUN_8000_Székesfehérvár_Szlovák Utca 6,Igen,,HUF,33696228.0,HUF,Igen,nem ismert,,Nem,Nem,Nincs adat,3718/2020,,2020-03-02,Tájékoztató az eljárás eredményéről,-4 days,46446,Mór Városi Önkormányzat,ÚTÉPPARK Útépítő és Mélyépítő Kft.
EKR001599222019,,,Okány Község Önkormányzata,15725307204,Nem,Nem,N - Regionális/helyi szintű,KL - Egyéb tevékenység:,Nemzeti eljárásrend,Kbt. 115. § Nyílt eljárás,Okány-Környezetvédelmi infrastruktúra fejlesztése,Építési beruházás,119577770.0,HUF,45247000-0,45247000-0,HU332,Igen,Nem,Igen,Igen,Igen,,2020-04-17,4.0,Nem,Penta Általános Építőipari Korlátolt Felelősségű Társaság,"10452556244,HU10452556",HUN_2100_Gödöllő_Kenyérgyári Út 1/E.,Igen,104887200.0,HUF,119577770.0,HUF,Nem,,,Nem,Nem,Nincs adat,7151/2020,,2020-04-23,Tájékoztató az eljárás eredményéről,-6 days,46663,Okány Község Önkormányzata,Penta Általános Építőipari Korlátolt Felelősségű Társaság
EKR000459462018,,,Debreceni Egyetem,15329750409,Nem,Nem,U - Egyéb típus:,KL - Oktatás,Nemzeti eljárásrend,Kbt. 115. § Nyílt eljárás,DEK-631 Balásházy Kollégium belső felújítás munkái,Építési beruházás,142823351.0,HUF,45000000-7,45262700-8|45000000-7|45111100-9|45442100-8|45421146-9,HU321,Igen,Nem,Igen,Nem,Igen,,2018-09-18,3.0,Nem,TÖMB 2002 Szolgáltató Korlátolt Felelősségű Társaság,"22757937209,HU22757937",HUN_4220_Hajdúböszörmény_Désány István Utca 16. IV/15. ,Igen,,HUF,142823351.0,HUF,Nem,,,Nem,Nem,Nincs adat,17454/2018,,2018-09-30,Tájékoztató az eljárás eredményéről,-12 days,46688,Debreceni Egyetem,TÖMB 2002 Szolgáltató Korlátolt Felelősségű Társaság
EKR001634062019,,,Berettyóújfalui Tankerületi Központ,15835365209,Nem,Nem,N - Regionális/helyi szintű,KL - Oktatás,Nemzeti eljárásrend,Kbt. 115. § Nyílt eljárás,Zeneiskola funkciójú iskolaépület építése,Építési beruházás,231675549.0,HUF,45214200-2,45310000-3|45262311-4|45262650-2|45262500-6|45262310-7|45260000-7|45262210-6|45442100-8|45421152-4|45332200-5|45421100-5,HU321,Igen,Nem,Igen,Igen,Igen,,2020-03-26,3.0,Nem,TÖMB 2002 Szolgáltató Korlátolt Felelősségű Társaság,"22757937209,HU22757937",HUN_4220_Hajdúböszörmény_Polgári  Utca 13.,Igen,230902619.0,HUF,231675549.0,HUF,Igen,"Ara-Terv Bt. (adószáma: 22872339-1-09), CS-Control Kft. (adószáma: 23849325-2-09)",nem releváns.,Nem,Nem,Nincs adat,5668/2020,,2020-03-31,Tájékoztató az eljárás eredményéről,-5 days,47001,Berettyóújfalui Tankerületi Központ,TÖMB 2002 Szolgáltató Korlátolt Felelősségű Társaság
EKR000017882020,,,Győr Megyei Jogú Város Önkormányzata,15735595208,Nem,Nem,U - Regionális vagy helyi hatóság,KL - Általános közszolgáltatások,Uniós eljárásrend,Nyílt eljárás,Kivitelezési szerződés - Eötvös park,Építési beruházás,98479157.0,HUF,45236290-9,37535280-3|37535200-9|43325000-7|45233260-9|45233200-1|45236250-7|45233293-9|45236210-5|45112711-2|45112723-9|45111200-0|45111100-9|45111291-4,HU221,Igen,Nem,Igen,Igen,Igen,,2020-06-23,3.0,Nem,STRABAG Általános Építő Korlátolt Felelősségű Társaság,"11705053444,01-09-930940",HUN_1117_Budapest_Gábor Dénes (Infopark D épület) Utca 2.,Nem,,HUF,98479157.0,HUF,Igen,,"Székely Árpád Sándor (9111 Tényő, Dózsa utca 3.) 63855283228; M2.2)",Nem,Nem,Nincs adat,11564/2020,2020/S 127-309539,2020-07-05,Tájékoztató az eljárás eredményéről,-12 days,47242,Győr Megyei Jogú Város Önkormányzata,STRABAG Általános Építő Korlátolt Felelősségű Társaság
EKR001628762019,,,Debreceni Vagyonkezelő Zártkörűen Működő Részvénytársaság,11995340209,Nem,Nem,U - Közjogi intézmény,KL - Gazdasági és pénzügyek,Uniós eljárásrend,Nyílt eljárás,Útépítés ipari parkban,Építési beruházás,294498132.0,HUF,45233120-6,45316000-5|45233228-3|45232450-1|45233120-6,HU321,Igen,Nem,Igen,Nem,Igen,,2020-02-25,9.0,Nem,Colas Út Építőipari Zártkörűen Működő Részvénytársaság,"14904134244,HU14904134",HUN_1113_Budapest_Bocskai Út 73.,Nem,,HUF,294498132.0,HUF,Igen,nem ismert,,Nem,Nem,Nincs adat,3693/2020,2020/S 049-115166,2020-03-11,Tájékoztató az eljárás eredményéről,-15 days,47252,Debreceni Vagyonkezelő Zártkörűen Működő Részvénytársaság,Colas Út Építőipari Zártkörűen Működő Részvénytársaság
EKR000015512020,2,"Pásztor utca 91. (""Manóvárovi"") ",Békéscsaba Megyei Jogú Város Önkormányzata,15725369204,Nem,Nem,N - Regionális/helyi szintű,KL - Általános közszolgáltatások,Nemzeti eljárásrend,Kbt. 113. § Nyílt eljárás,Pásztor u.-i ovik - energetikai korszerűsítés,Építési beruházás,81385500.0,HUF,45000000-7,45000000-7|45310000-3|45261400-8|45321000-3|45350000-5,HU332,Igen,Nem,Igen,Igen,Igen,,2020-05-14,4.0,Nem,TÖMB 2002 Szolgáltató Korlátolt Felelősségű Társaság,"22757937209,HU22757937",HUN_4220_Hajdúböszörmény_Polgári  Utca 13.,Igen,76896452.0,HUF,81385500.0,HUF,Igen,"ARA-TERV Ipari és Szolgáltató Betéti Társaság (4031 Debrecen, Ond utca 6.) Adószáma: 22872339-1-09, CS-Control Építőipari Kereskedelmi és Szolgáltató Korlátolt Felelősségű Társaság (4220 Hajdúböszörmény, Arad utca 10.) Adószáma: 23849325-2-09","ARA-TERV Ipari és Szolgáltató Bt.(4031 Debrecen, Ond utca 6.) Adószáma: 22872339-1-09 M.1.1. Alkalmassági követelmény.  CS-Control Építőipari Kereskedelmi és Szolgáltató Kft. (4220 Hajdúböszörmény, Arad utca 10.) Adószám: 23849325-2-09 M.1.2. alkalmasság",Nem,Nem,Nincs adat,8850/2020,,2020-05-19,Tájékoztató az eljárás eredményéről,-5 days,47270,Békéscsaba Megyei Jogú Város Önkormányzata,TÖMB 2002 Szolgáltató Korlátolt Felelősségű Társaság
EKR000029542020,1,Látogatóközpont bővítése és átalakítása,Hortobágyi Nemzeti Park Igazgatóság|Hortobágy Község Önkormányzata,15323871209|15728647209,Igen,Nem,N - Közjogi szervezet,KL - Környezetvédelem,Nemzeti eljárásrend,Kbt. 117. § Saját beszerzési szabályok alkalmazása részvételi szakasz nélkül,Építési beruházás I. - GINOP-7.1.9-17-2018-00024,Építési beruházás,108165805.0,HUF,45453100-8,45310000-3|45262800-9|45262520-2|45262522-6|45262700-8|45324000-4|45330000-9,HU321,Igen,Nem,Igen,Igen,Igen,,2020-07-22,3.0,Nem,TÖMB 2002 Szolgáltató Korlátolt Felelősségű Társaság,"22757937209,HU22757937",HUN_4220_Hajdúböszörmény_Polgári  Utca 13.,Igen,69234486.0,HUF,108165805.0,HUF,Igen,"Ara-Terv Bt. (adószáma: 22872339-1-09), CS-Control Kft. (adószáma: 23849325-2-09)","Ara-Terv Bt. (adószáma: 22872339-1-09)- az eljárást megindító felhívás III.1.3) pont M.2.1) alkalmassági feltétel, CS-Control Kft. (adószáma: 23849325-2-09) - az eljárást megindító felhívás III.1.3) pont M.2.2) alkalmassági feltétel.",Nem,Nem,Nincs adat,13564/2020,,2020-07-26,Tájékoztató az eljárás eredményéről,-4 days,47399,Hortobágyi Nemzeti Park Igazgatóság|Hortobágy Község Önkormányzata,TÖMB 2002 Szolgáltató Korlátolt Felelősségű Társaság
EKR000095282020,,,NFSI Nemzeti Fejlesztési és Stratégiai Intézet Nonprofit Kft.|Klebelsberg Központ,25118764241|15799658241,Igen,Nem,U - Közjogi intézmény,KL - Egyéb tevékenység:,Uniós eljárásrend,Nyílt eljárás,Klebelsberg Központ - Békés megye - Tótkomlós,Építési beruházás,103501075.0,HUF,45000000-7,45000000-7,HU,Igen,Nem,Igen,Igen,Igen,,2021-09-14,6.0,Nem,TÖMB 2002 Szolgáltató Korlátolt Felelősségű Társaság,"22757937209,HU22757937",HUN_4220_Hajdúböszörmény_Polgári  Utca 13.,Igen,,HUF,103501075.0,HUF,Igen,"ARA-TERV Ipari és Szolgáltató Bt. Adószám: 22872339-1-09, CZVIGÁZ FŰTÉSTECHNIKA Kereskedelmi és Szolgáltató Kft. adószám: 23759688-2-15, Ipolyi Plan-Ing 2020 Mérnöki és Szolgáltató Kft. adószám:  27089152-2-09, ÉPÍT-TAKARÍT 2004 Bt. adószám: 22124801-2-09","ARA-TERV Ipari és Szolgáltató Bt. Adószám: 22872339-1-09 alk.köv.: felhívás III.1.3. M.2.1. szerinti szakember, Ipolyi Plan-Ing 2020 Mérnöki és Szolgáltató Kft. adószám:  27089152-2-09 alk.köv: felhívás III.1.3. M.2.2. szerinti szakember",Nem,Nem,Nincs adat,18058/2021,2021/S 183-475080,2021-09-21,Tájékoztató az eljárás eredményéről,-7 days,47723,NFSI Nemzeti Fejlesztési és Stratégiai Intézet Nonprofit Kft.|Klebelsberg Központ,TÖMB 2002 Szolgáltató Korlátolt Felelősségű Társaság
EKR000126302020,,,Berettyóújfalui Tankerületi Központ,15835365209,Nem,Nem,N - Regionális/helyi szintű,KL - Oktatás,Nemzeti eljárásrend,Kbt. 115. § Nyílt eljárás,"EFOP-4.1.2-17-2017-00089 - Földes, emeletráépítés",Építési beruházás,294130000.0,HUF,45262800-9,45111100-9|45214200-2|45310000-3|45312100-8|45262500-6|45262310-7|45313100-5|45320000-6|45332200-5|45321000-3|45421100-5|45410000-4|45331000-6|45443000-4|45430000-0|45442100-8,HU321,Igen,Nem,Igen,Igen,Igen,,2020-04-24,3.0,Nem,TÖMB 2002 Szolgáltató Korlátolt Felelősségű Társaság,"22757937209,HU22757937",HUN_4220_Hajdúböszörmény_Polgári  Utca 13.,Igen,299658400.0,HUF,294130000.0,HUF,Igen,"Ara-Terv Bt. (adószáma: 22872339-1-09), CS-Control Kft. (adószáma: 23849325-2-09)",nem releváns.,Nem,Nem,Nincs adat,7537/2020,,2020-04-29,Tájékoztató az eljárás eredményéről,-5 days,48134,Berettyóújfalui Tankerületi Központ,TÖMB 2002 Szolgáltató Korlátolt Felelősségű Társaság
EKR000145532020,,,NIF Nemzeti Infrastruktúra Fejlesztő zártkörűen működő Részvénytársaság,11906522241,Nem,Nem,N - Közjogi szervezet,KL - Egyéb tevékenység:,Nemzeti eljárásrend,Kbt. 117. § Saját beszerzési szabályok alkalmazása részvételi szakasz nélkül,Nagyrozvágy-Nagygéres kapcs. kialakítása - építés,Építési beruházás,458500000.0,HUF,45000000-7,45233120-6|45233125-1|45233140-2|45233221-4,HU311,Igen,Nem,Igen,Igen,Igen,,2020-10-12,6.0,Nem,Colas Út Építőipari Zártkörűen Működő Részvénytársaság,"14904134244,HU14904134",HUN_1113_Budapest_Bocskai Út 73.,Nem,,HUF,458500000.0,HUF,Nem,nem releváns,nem vesz igénybe,Nem,Nem,Nincs adat,19169/2020,,2020-10-19,Tájékoztató az eljárás eredményéről,-7 days,48266,NIF Nemzeti Infrastruktúra Fejlesztő zártkörűen működő Részvénytársaság,Colas Út Építőipari Zártkörűen Működő Részvénytársaság
EKR000152172020,,,Tabajd Község Önkormányzata,15727574207,Nem,Nem,N - Regionális/helyi szintű,KL - Általános közszolgáltatások,Nemzeti eljárásrend,Kbt. 115. § Nyílt eljárás,Külterületi helyi közutak fejlesztése ,Építési beruházás,62995684.0,HUF,45000000-7,45221250-9|45233223-8|45233142-6|45000000-7,HU211,Igen,Nem,Igen,Igen,Igen,,2020-04-08,4.0,Nem,ÚTÉPPARK Útépítő és Mélyépítő Kft.,"24105099207,24105099",HUN_8000_Székesfehérvár_Szlovák Utca 6,Igen,61711343.0,HUF,62995684.0,HUF,Nem,,,Nem,Nem,Nincs adat,6933/2020,,2020-04-16,Tájékoztató az eljárás eredményéről,-8 days,48279,Tabajd Község Önkormányzata,ÚTÉPPARK Útépítő és Mélyépítő Kft.
EKR000503592018,,,Jászberény Városi Önkormányzat,15732671216,Nem,Nem,N - Regionális/helyi szintű,KL - Általános közszolgáltatások,Nemzeti eljárásrend,Kbt. 115. § Nyílt eljárás,Jászberény - Zöld város kialakítása - mélyépítés,Építési beruházás,294993440.0,HUF,45000000-7,45233253-7|45233252-0|45233250-6|45000000-7|45213316-1|45112711-2|45112710-5|45231000-5|45233120-6|45232130-2,HU322,Igen,Nem,Igen,Igen,Igen,,2018-11-10,2.0,Nem,Penta Általános Építőipari Korlátolt Felelősségű Társaság,"10452556244,HU10452556",HUN_2100_Gödöllő_Kenyérgyári Út 1/E. ,Igen,,HUF,294993440.0,HUF,Nem,,,Nem,Nem,Nincs adat,21160/2018,,2018-11-22,Tájékoztató az eljárás eredményéről,-12 days,48788,Jászberény Városi Önkormányzat,Penta Általános Építőipari Korlátolt Felelősségű Társaság
