EKR001187982021,,,Győr Megyei Jogú Város Önkormányzata,15735595208,Nem,Nem,U - Regionális vagy helyi hatóság,KL - Általános közszolgáltatások,Uniós eljárásrend,Nyílt eljárás,Kuopio park parkolás fejlesztés,Építési beruházás,733512541.0,HUF,45223300-9,45233228-3|45233161-5|45223300-9|45112711-2,HU221,Igen,Nem,Igen,Nem,Igen,,2022-02-10,1.0,Nem,Penta Általános Építőipari Korlátolt Felelősségű Társaság,"10452556244,HU10452556",HUN_2100_Gödöllő_Kenyérgyári Út 1/E.,Igen,447421134.0,HUF,733512541.0,HUF,Igen,"PANNON PARK FOREST Kft. adószám: 11630979-2-43, Szűcs Zoltán adóazonosító jel: 8397013822, Nagy Dénes adóazonosító jel: 8406980877","III.1.3) M.1.2.: PANNON PARK FOREST Kft. adószám: 11630979-2-43, III.1.3) M.2.3: Szűcs Zoltán adóazonosító jel: 8397013822, III.1.3) M.2.2.: Nagy Dénes adóazonosító jel: 8406980877",Nem,Nem,Nincs adat,3257/2022,2022/S 040-100181,2022-02-24,Tájékoztató az eljárás eredményéről,-14 days,64247,Győr Megyei Jogú Város Önkormányzata,Penta Általános Építőipari Korlátolt Felelősségű Társaság
EKR000751632018,,,Mór Városi Önkormányzat,15727220207,Nem,Nem,N - Regionális/helyi szintű,KL - Általános közszolgáltatások,Nemzeti eljárásrend,Kbt. 115. § Nyílt eljárás,Mór- Ady Endre utca,Építési beruházás,29031084.0,HUF,45233142-6,45233142-6,HU211,Igen,Nem,Igen,Nem,Igen,,2019-01-15,4.0,Nem,ÚTÉPPARK Útépítő és Mélyépítő Kft.,"24105099207,24105099",HUN_8000_Székesfehérvár_Sóstói Út 7 ,Igen,,HUF,29031084.0,HUF,Igen,Nem ismert.,-,Nem,Nem,Nincs adat,1119/2019,,2019-02-11,Tájékoztató az eljárás eredményéről,-27 days,64377,Mór Városi Önkormányzat,ÚTÉPPARK Útépítő és Mélyépítő Kft.
EKR001322262021,,,Fóti Közszolgáltató Közhasznú Nonprofit Kft.,14539262213,Nem,Nem,U - Regionális vagy helyi hatóság,KL - Általános közszolgáltatások,Uniós eljárásrend,Nyílt eljárás,Keretmegállapodás mélyépítés,Építési beruházás,1500000000.0,HUF,45000000-7,45000000-7,HU120,Igen,Nem,Igen,Nem,Igen,,2022-04-11,2.0,Nem,Penta Általános Építőipari Korlátolt Felelősségű Társaság,"10452556244,HU10452556",HUN_2100_Gödöllő_Kenyérgyári Út 1/E.,Igen,,HUF,1500000000.0,HUF,Igen,Még nem ismert.,,Igen,Nem,Nincs adat,7518/2022,2022/S 076-206552,2022-04-19,Tájékoztató az eljárás eredményéről,-8 days,64412,Fóti Közszolgáltató Közhasznú Nonprofit Kft.,Penta Általános Építőipari Korlátolt Felelősségű Társaság
EKR001357312021,,,Győrzámoly Község Önkormányzata,15727794208,Nem,Nem,N - Regionális/helyi szintű,KL - Általános közszolgáltatások,Nemzeti eljárásrend,Kbt. 115. § Nyílt eljárás,"Dergiták útja, Győri út szilárd burkolat készítése",Építési beruházás,32806520.0,HUF,45233120-6,45233120-6,HU221,Igen,Nem,Igen,Nem,Igen,,2022-01-21,5.0,Nem,STRABAG Általános Építő Korlátolt Felelősségű Társaság,"11705053444,01-09-930940",HUN_1117_Budapest_Gábor Dénes (Infopark D épület) Utca 2.,Nem,,HUF,32806520.0,HUF,Nem,,,Nem,Nem,Nincs adat,1830/2022,,2022-01-27,Tájékoztató az eljárás eredményéről,-6 days,64483,Győrzámoly Község Önkormányzata,STRABAG Általános Építő Korlátolt Felelősségű Társaság
EKR001462672021,,,Kecskemét Megyei Jogú Város Önkormányzata,15724540203,Nem,Nem,U - Regionális vagy helyi iroda/hivatal,KL - Általános közszolgáltatások,Uniós eljárásrend,Nyílt eljárás,„Hetényegyháza bekötése az M5 autópályába”,Építési beruházás,1394974464.0,HUF,45221250-9,71000000-8|71356400-2|71320000-7|45247130-0|45233220-7|45233228-3|45233290-8|45233221-4|45231000-5|45112730-1|45221250-9|45112712-9|45111000-8|45111290-7|45233120-6|45232452-5,HU331,Igen,Nem,Igen,Igen,Igen,,2022-08-02,2.0,Nem,Colas Út Építőipari Zártkörűen Működő Részvénytársaság,"14904134244,HU14904134",HUN_1113_Budapest_Bocskai Út 73.,Nem,1398856692.0,HUF,1394974464.0,HUF,Igen,Ajánlatkérő nem írta elő tárgyi közbeszerzési eljárás tekintetében a Kbt. 66. § (6) bekezdése szerinti adatok megadását.,"Civil Expert Mérnökiroda Kft. (1143 Budapest, Stefánia út 9. fszt. 3., adószám: 25584345-2-42) - III.1.1) SZ.1/ és III.1.3) M.2.3.",Nem,Nem,Nincs adat,16946/2022,2022/S 155-439352,2022-08-12,Tájékoztató az eljárás eredményéről,-10 days,65159,Kecskemét Megyei Jogú Város Önkormányzata,Colas Út Építőipari Zártkörűen Működő Részvénytársaság
EKR001488982021,,,Társadalmi Infrastruktúra Fejlesztő Nonprofit Korlátolt Felelősségű Társaság,18549878242,Nem,Nem,N - Közjogi szervezet,KL - Egyéb tevékenység:,Nemzeti eljárásrend,Kbt. 115. § Nyílt eljárás,EMMI Debreceni Javítóintézet kivitelezés,Építési beruházás,99504550.0,HUF,45000000-7,45000000-7,HU321,Igen,Nem,Igen,Nem,Igen,,2021-12-13,4.0,Nem,TÖMB 2002 Szolgáltató Korlátolt Felelősségű Társaság,"22757937209,HU22757937",HUN_4220_Hajdúböszörmény_Polgári  Utca 13.,Igen,87276327.0,HUF,99504550.0,HUF,Igen,,,Nem,Nem,Nincs adat,25108/2021,,2021-12-15,Tájékoztató az eljárás eredményéről,-2 days,65186,Társadalmi Infrastruktúra Fejlesztő Nonprofit Korlátolt Felelősségű Társaság,TÖMB 2002 Szolgáltató Korlátolt Felelősségű Társaság
EKR000779142018,,,DUNASZIGET KÖZSÉGI ÖNKORMÁNYZAT,15727914208,Nem,Nem,N - Regionális/helyi szintű,KL - Általános közszolgáltatások,Nemzeti eljárásrend,Kbt. 115. § Nyílt eljárás,Árok építés,Építési beruházás,159882660.0,HUF,45000000-7,45000000-7,HU221,Igen,Nem,Igen,Igen,Igen,,2018-11-29,2.0,Nem,STRABAG Általános Építő Korlátolt Felelősségű Társaság,"11705053444,01-09-930940",HUN_1117_Budapest_Gábor Dénes (Infopark D épület) Utca 2.  ,Nem,173228346.0,HUF,159882660.0,HUF,Igen,nem ismert.,Nem releváns.,Nem,Nem,Nincs adat,22539/2018,,2018-12-06,Tájékoztató az eljárás eredményéről,-7 days,65578,DUNASZIGET KÖZSÉGI ÖNKORMÁNYZAT,STRABAG Általános Építő Korlátolt Felelősségű Társaság
EKR001544842021,,,Belváros-Lipótváros Budapest Főváros V. kerület Önkormányzat,15735681241,Nem,Nem,U - Regionális vagy helyi hatóság,KL - Általános közszolgáltatások,Uniós eljárásrend,Keretmegállapodás alapján írásbeli konzultáció,Belvárosi Futópálya Építési Program – I. ütem,Építési beruházás,75362502.0,HUF,45000000-7,45000000-7,HU110,Nem,Nem,Igen,Nem,Igen,,2021-12-20,1.0,Nem,Penta Általános Építőipari Korlátolt Felelősségű Társaság,"10452556244,HU10452556",HUN_2100_Gödöllő_Kenyérgyári Út 1/E.,Igen,,HUF,75362502.0,HUF,Igen,Még nem ismert.,,Nem,Nem,Nincs adat,25794/2021,2022/S 010-017152,2022-01-14,Tájékoztató az eljárás eredményéről,-25 days,65957,Belváros-Lipótváros Budapest Főváros V. kerület Önkormányzat,Penta Általános Építőipari Korlátolt Felelősségű Társaság
EKR001646962021,,,Társadalmi Infrastruktúra Fejlesztő Nonprofit Korlátolt Felelősségű Társaság,18549878242,Nem,Nem,N - Közjogi szervezet,KL - Egyéb tevékenység:,Nemzeti eljárásrend,Kbt. 115. § Nyílt eljárás,SZGYF - Békéscsaba - kivitelezés,Építési beruházás,84973400.0,HUF,45000000-7,45000000-7|45310000-3|45331100-7|45332000-3,HU332,Igen,Nem,Igen,Nem,Igen,,2021-12-28,3.0,Nem,TÖMB 2002 Szolgáltató Korlátolt Felelősségű Társaság,"22757937209,HU22757937",HUN_4220_Hajdúböszörmény_Polgári  Utca 13.,Igen,53859614.0,HUF,84973400.0,HUF,Igen,,,Nem,Nem,Nincs adat,26663/2021,,2022-01-05,Tájékoztató az eljárás eredményéről,-8 days,65982,Társadalmi Infrastruktúra Fejlesztő Nonprofit Korlátolt Felelősségű Társaság,TÖMB 2002 Szolgáltató Korlátolt Felelősségű Társaság
EKR001660762021,,,Országos Gyermekvédelmi Szakszolgálat,15372246109,Nem,Nem,N - Regionális/helyi szintű,KL - Szociális védelem,Nemzeti eljárásrend,Kbt. 115. § Nyílt eljárás,Gyula Eminescu utcai felújítás,Építési beruházás,39535119.0,HUF,45210000-2,45210000-2,HU332,Igen,Nem,Igen,Nem,Igen,,2022-01-03,2.0,Nem,TÖMB 2002 Szolgáltató Korlátolt Felelősségű Társaság,"22757937209,HU22757937",HUN_4220_Hajdúböszörmény_Polgári  Utca 13.,Igen,41775093.0,HUF,39535119.0,HUF,Igen,"Ara-Terv Bt. (4031 Debrecen, Ond utca 6., adószám:  22872339-1-09)",,Nem,Nem,Nincs adat,0067/2022,,2022-01-11,Tájékoztató az eljárás eredményéről,-8 days,66020,Országos Gyermekvédelmi Szakszolgálat,TÖMB 2002 Szolgáltató Korlátolt Felelősségű Társaság
EKR000158152018,,,Felsőzsolca Város Önkormányzata,15725950205,Nem,Nem,N - Regionális/helyi szintű,KL - Általános közszolgáltatások,Nemzeti eljárásrend,Kbt. 115. § Nyílt eljárás,Építési beruházás,Építési beruházás,252657696.0,HUF,45231300-8,45231300-8,HU311,Igen,Nem,Igen,Nem,Igen,,2018-06-20,5.0,Nem,Penta Általános Építőipari Korlátolt Felelősségű Társaság,"10452556244,HU10452556",HUN_2100_Gödöllő_Kenyérgyári Út 1/E. ,Igen,289453242.0,HUF,252657696.0,HUF,Igen,Ismeretlen.,Nincs.,Nem,Nem,Nincs adat,11787/2018,,2018-07-16,Tájékoztató az eljárás eredményéről,-26 days,66232,Felsőzsolca Város Önkormányzata,Penta Általános Építőipari Korlátolt Felelősségű Társaság
EKR000033402022,1,"Épület felújítási, karbantartási munkák I.",Békés Megyei Kormányhivatal,15789264204,Nem,Nem,N - Regionális/helyi szintű,KL - Egyéb tevékenység:,Nemzeti eljárásrend,Kbt. 115. § Nyílt eljárás,"BÉMKH épületeinek felújítási, karbantartási munkái",Építési beruházás,89837496.0,HUF,45453100-8,45300000-0|45453100-8|45210000-2|45400000-1,HU332,Igen,Nem,Igen,Nem,Igen,,2022-03-16,5.0,Nem,TÖMB 2002 Szolgáltató Korlátolt Felelősségű Társaság,"22757937209,HU22757937",HUN_4220_Hajdúböszörmény_Polgári  Utca 13.,Igen,,HUF,29945832.0,HUF,Nem,,,Nem,Nem,Nincs adat,5418/2022,,2022-03-21,Tájékoztató az eljárás eredményéről,-5 days,66516,Békés Megyei Kormányhivatal,TÖMB 2002 Szolgáltató Korlátolt Felelősségű Társaság
EKR000167132022,,,Vasútegészségügyi Szolgáltató Nonprofit Közhasznú Korlátolt Felelősségű Társaság,18159422242,Nem,Nem,N - Közjogi szervezet,KL - Egészségügy,Nemzeti eljárásrend,Kbt. 112. § (1) bekezdés b) pont Nyílt eljárás (hirdetménnyel induló),(PTS-325) energetikai fejl. KEHOP-5.2.2 – Debrecen,Építési beruházás,506167983.0,HUF,45000000-7,45261210-9|45310000-3|45350000-5|45321000-3|45000000-7|45453100-8,HU321,Igen,Nem,Igen,Igen,Igen,,2022-06-28,6.0,Nem,TÖMB 2002 Szolgáltató Korlátolt Felelősségű Társaság,"22757937209,HU22757937",HUN_4220_Hajdúböszörmény_Polgári  Utca 13.,Igen,,HUF,506167983.0,HUF,Igen,"Ara-Terv Betéti Társaság, 22872339-1-09; Ipolyi Plan-Ing 2020 Mérnöki és Szolgáltató Korlátolt Felelősségű Társaság, 27089152-2-09","Ara-Terv Betéti Társaság, 22872339-1-09, M2.1.; Ipolyi Plan-Ing 2020 Mérnöki és Szolgáltató Korlátolt Felelősségű Társaság, 27089152-2-09, M2.2.",Nem,Nem,Nincs adat,13693/2022,,2022-06-30,Tájékoztató az eljárás eredményéről,-2 days,67226,Vasútegészségügyi Szolgáltató Nonprofit Közhasznú Korlátolt Felelősségű Társaság,TÖMB 2002 Szolgáltató Korlátolt Felelősségű Társaság
EKR000227492022,,,Belváros-Lipótváros Budapest Főváros V. kerület Önkormányzat,15735681241,Nem,Nem,U - Regionális vagy helyi hatóság,KL - Általános közszolgáltatások,Uniós eljárásrend,Keretmegállapodás alapján írásbeli konzultáció,„Arany J. u. megújítása II. ütem” kivitelezés,Építési beruházás,1394272151.0,HUF,45000000-7,45000000-7,HU11,Nem,Nem,Igen,Nem,Igen,,2022-04-11,1.0,Nem,Penta Általános Építőipari Korlátolt Felelősségű Társaság,"10452556244,HU10452556",HUN_2100_Gödöllő_Kenyérgyári Út 1/E.,Igen,,HUF,1394272151.0,HUF,Igen,még nem ismert,,Nem,Nem,Nincs adat,7764/2022,2022/S 080-214319,2022-04-25,Tájékoztató az eljárás eredményéről,-14 days,67502,Belváros-Lipótváros Budapest Főváros V. kerület Önkormányzat,Penta Általános Építőipari Korlátolt Felelősségű Társaság
EKR000099062022,,,Lébény Város Önkormányzata,15727952208,Nem,Nem,N - Regionális/helyi szintű,KL - Általános közszolgáltatások,Nemzeti eljárásrend,Kbt. 115. § Nyílt eljárás,"Lébény, Széles utca (Fő utca) felújítása",Építési beruházás,26812532.0,HUF,45233120-6,45233120-6|45233220-7,HU221,Igen,Nem,Igen,Nem,Igen,,2022-04-12,3.0,Nem,STRABAG Általános Építő Korlátolt Felelősségű Társaság,"11705053444,01-09-930940",HUN_1117_Budapest_Gábor Dénes (Infopark D épület) Utca 2.,Nem,,HUF,26812532.0,HUF,Igen,,,Nem,Nem,Nincs adat,7790/2022,,2022-04-20,Tájékoztató az eljárás eredményéről,-8 days,67751,Lébény Város Önkormányzata,STRABAG Általános Építő Korlátolt Felelősségű Társaság
EKR000303372022,,,Belváros-Lipótváros Budapest Főváros V. kerület Önkormányzat,15735681241,Nem,Nem,U - Regionális vagy helyi hatóság,KL - Általános közszolgáltatások,Uniós eljárásrend,Keretmegállapodás alapján írásbeli konzultáció,Déli Váci utca és környéke megújítása kivitelezés,Építési beruházás,1782571787.0,HUF,45000000-7,45000000-7,HU110,Nem,Nem,Igen,Nem,Igen,,2022-04-28,1.0,Nem,Penta Általános Építőipari Korlátolt Felelősségű Társaság,"10452556244,HU10452556",HUN_2100_Gödöllő_Kenyérgyári Út 1/E.,Igen,,HUF,1782571787.0,HUF,Igen,még nem ismert,,Nem,Nem,Nincs adat,9034/2022,2022/S 093-252846,2022-05-13,Tájékoztató az eljárás eredményéről,-15 days,67813,Belváros-Lipótváros Budapest Főváros V. kerület Önkormányzat,Penta Általános Építőipari Korlátolt Felelősségű Társaság
EKR000129842022,,,Belváros-Lipótváros Budapest Főváros V. kerület Önkormányzat,15735681241,Nem,Nem,U - Regionális vagy helyi hatóság,KL - Általános közszolgáltatások,Uniós eljárásrend,Keretmegállapodás alapján írásbeli konzultáció,Zöld utasvárók telepítése 3 - 2022,Építési beruházás,33917426.0,HUF,45000000-7,45000000-7,HU11,Nem,Nem,Igen,Nem,Igen,,2022-03-23,1.0,Nem,Penta Általános Építőipari Korlátolt Felelősségű Társaság,"10452556244,HU10452556",HUN_2100_Gödöllő_Kenyérgyári Út 1/E.,Igen,,HUF,33917426.0,HUF,Igen,még nem ismert,,Nem,Nem,Nincs adat,5868/2022,2022/S 067-176137,2022-04-05,Tájékoztató az eljárás eredményéről,-13 days,67914,Belváros-Lipótváros Budapest Főváros V. kerület Önkormányzat,Penta Általános Építőipari Korlátolt Felelősségű Társaság
EKR000240572022,,,ACÉLMAX Szolgáltató és Kereskedelmi Zártkörűen Működő Részvénytársaság|Magyar Közút Nonprofit Zártkörűen Működő Részvénytársaság|Sajókeresztúr Község Önkormányzata,24794534205|14605749244|15726061205,Igen,Nem,N - Támogatott szervezet [Kbt. 5. § (2) bekezdés],KL - Egyéb tevékenység:,Nemzeti eljárásrend,Kbt. 112. § (1) bekezdés b) pont Nyílt eljárás (hirdetménnyel induló),Iparterület fejlesztés Sajókeresztúron – II. ütem,Építési beruházás,324101349.0,HUF,45000000-7,45233120-6|45110000-1,HU311,Igen,Nem,Igen,Igen,Igen,,2022-09-14,5.0,Nem,Colas Út Építőipari Zártkörűen Működő Részvénytársaság,"14904134244,HU14904134",HUN_1113_Budapest_Bocskai Út 73.,Nem,,HUF,324101349.0,HUF,Igen,FABRICOM ELECTRICAL-PVV Kft. (adószám: 10797675-2-43),FABRICOM ELECTRICAL-PVV Kft. (adószám: 10797675-2-43) - III.1.3) M.2.2,Nem,Nem,Nincs adat,20069/2022,,2022-09-19,Tájékoztató az eljárás eredményéről,-5 days,68193,ACÉLMAX Szolgáltató és Kereskedelmi Zártkörűen Működő Részvénytársaság|Magyar Közút Nonprofit Zártkörűen Működő Részvénytársaság|Sajókeresztúr Község Önkormányzata,Colas Út Építőipari Zártkörűen Működő Részvénytársaság
EKR000423762022,,,Dunakeszi Város Önkormányzata,15731247213,Nem,Nem,U - Regionális vagy helyi iroda/hivatal,KL - Általános közszolgáltatások,Uniós eljárásrend,Keretmegállapodás alapján írásbeli konzultáció,Pálya-Rozmaring úti gyalogátkelőhely,Építési beruházás,17236381.0,HUF,45000000-7,45000000-7,HU120,Nem,Nem,Igen,Nem,Igen,,2022-05-24,1.0,Nem,Penta Általános Építőipari Korlátolt Felelősségű Társaság,"10452556244,HU10452556",HUN_2100_Gödöllő_Kenyérgyári Út 1/E.,Igen,,HUF,17236381.0,HUF,Nem,,,Nem,Nem,Nincs adat,16015/2022,2022/S 153-436316,2022-08-10,Tájékoztató az eljárás eredményéről,-78 days,68244,Dunakeszi Város Önkormányzata,Penta Általános Építőipari Korlátolt Felelősségű Társaság
EKR000561112022,,,Ságvár Község Önkormányzata,15396183214,Nem,Nem,N - Regionális/helyi szintű,KL - Általános közszolgáltatások,Nemzeti eljárásrend,Kbt. 112. § (1) bekezdés b) pont Nyílt eljárás (hirdetménnyel induló),Külterületi helyi közutak fejlesztése Ságváron,Építési beruházás,62956627.0,HUF,45233120-6,45112730-1|45233120-6|45233000-9|45232452-5|45233223-8|45233142-6|45233320-8|45233200-1,HU232,Igen,Nem,Igen,Igen,Igen,,2022-08-04,5.0,Nem,Colas Út Építőipari Zártkörűen Működő Részvénytársaság,"14904134244,HU14904134",HUN_1113_Budapest_Bocskai Út 73.,Nem,,HUF,62956627.0,HUF,Igen,"Colas Közlekedésépítő Zártkörűen Működő Részvénytársaság, asz.: 26090575-2-43","Colas Közlekedésépítő Zártkörűen Működő Részvénytársaság, asz.: 26090575-2-43 -  Af alkalmassági követelményt előíró pontja:  III.1.3) M.1.2. pontja ",Nem,Nem,Nincs adat,17126/2022,,2022-08-10,Tájékoztató az eljárás eredményéről,-6 days,68597,Ságvár Község Önkormányzata,Colas Út Építőipari Zártkörűen Működő Részvénytársaság
EKR000499882022,,,Bicske Város Önkormányzata|Magyar Közút Nonprofit Zártkörűen Működő Részvénytársaság,15727048207|14605749244,Igen,Nem,N - Regionális/helyi szintű,KL - Általános közszolgáltatások,Nemzeti eljárásrend,Kbt. 112. § (1) bekezdés b) pont Nyílt eljárás (hirdetménnyel induló),Bicske városi kerékpárút-hálózat fejlesztése II,Építési beruházás,123478906.0,HUF,45233162-2,45233162-2,HU211,Igen,Nem,Igen,Igen,Igen,,2022-08-29,5.0,Nem,ÚTÉPPARK Útépítő és Mélyépítő Kft.,"24105099207,24105099",HUN_8000_Székesfehérvár_Szlovák Utca 6,Igen,,HUF,123478906.0,HUF,Igen,"RONEKO Kft. (10653386-2-07), a többi jelenleg nem ismert.","RONEKO Kft. (10653386-2-07),III.1.3) M.2.2.)",Nem,Nem,Nem,18718/2022,,2022-09-01,Tájékoztató az eljárás eredményéről,-3 days,69137,Bicske Város Önkormányzata|Magyar Közút Nonprofit Zártkörűen Működő Részvénytársaság,ÚTÉPPARK Útépítő és Mélyépítő Kft.
EKR000750842022,,,Leányfalu Nagyközség Önkormányzata,15731003213,Nem,Nem,N - Regionális/helyi szintű,KL - Általános közszolgáltatások,Nemzeti eljárásrend,Kbt. 112. § (1) bekezdés b) pont Nyílt eljárás (hirdetménnyel induló),Iciri – Piciri Bölcsőde építése,Építési beruházás,439079781.0,HUF,45000000-7,45262500-6|45310000-3|45421100-5|45350000-5|45321000-3,HU120,Igen,Nem,Igen,Igen,Igen,,2022-09-14,10.0,Nem,TÖMB 2002 Szolgáltató Korlátolt Felelősségű Társaság,"22757937209,HU22757937",HUN_4220_Hajdúböszörmény_Polgári  Utca 13.,Igen,473406112.0,HUF,439079781.0,HUF,Igen,"Ara-Terv Bt. (4031 Debrecen, Ond utca 6.) asz: 22872339-2-09","Ara-Terv Bt. (4031 Debrecen, Ond utca 6.) asz: 22872339-2-09, M/1 feltétel",Nem,Nem,Nincs adat,20249/2022,,2022-09-21,Tájékoztató az eljárás eredményéről,-7 days,69274,Leányfalu Nagyközség Önkormányzata,TÖMB 2002 Szolgáltató Korlátolt Felelősségű Társaság
EKR000549512022,,,Hajdú-Bihar Megyei Kormányhivatal,15789312209,Nem,Nem,N - Központi szintű,KL - Általános közszolgáltatások,Nemzeti eljárásrend,Kbt. 117. § Saját beszerzési szabályok alkalmazása részvételi szakasz nélkül,"Debrecen, Piac u. 42-48. alatti épület fejlesztése",Építési beruházás,308974800.0,HUF,45453100-8,45431200-9|45442100-8|45432100-5|45111100-9|45262500-6|45313100-5|45314300-4|45310000-3|45312200-9|45312100-8|45311000-0|45324000-4|45332200-5|45350000-5|45331000-6|45410000-4,HU321,Igen,Nem,Igen,Nem,Igen,,2022-06-23,5.0,Nem,TÖMB 2002 Szolgáltató Korlátolt Felelősségű Társaság,"22757937209,HU22757937",HUN_4220_Hajdúböszörmény_Polgári  Utca 13.,Igen,340352884.0,HUF,308974800.0,HUF,Igen,"Ara-Terv Betéti Társaság (22872339-2-09), Ipolyi Plan-Ing 2020 Mérnöki és Szolgáltató Kft. (27089152-2-09), Zs-Tervezőiroda Kft. (26350027-2-09), OTIS Felvonó Kft. (10385054-2-41), Szabó Tiborné e.v. (adószáma az ajánlatból nem derül ki)","Ara-Terv Betéti Társaság (22872339-2-09) - III.1.3.) M.2.1), Ipolyi Plan-Ing 2020 Mérnöki és Szolgáltató Kft. (27089152-2-09) - III.1.3.) M.2.3), Zs-Tervezőiroda Kft. (26350027-2-09) - III.13.) M.2.2), OTIS Felvonó Kft. (10385054-2-41) - III.13.) M.2.4)",Nem,Nem,Nincs adat,13454/2022,,2022-06-28,Tájékoztató az eljárás eredményéről,-5 days,69322,Hajdú-Bihar Megyei Kormányhivatal,TÖMB 2002 Szolgáltató Korlátolt Felelősségű Társaság
EKR000565992022,,,NYÍRVV Nyíregyházi Városüzemeltető és Vagyonkezelő Nonprofit Kft.,10363315215,Nem,Nem,N - Közjogi szervezet,KL - Általános közszolgáltatások,Nemzeti eljárásrend,Kbt. 115. § Nyílt eljárás,Kátyúzás 2022.,Építési beruházás,120000000.0,HUF,45000000-7,45000000-7,HU323,Igen,Nem,Igen,Nem,Igen,,2022-05-31,3.0,Nem,STRABAG Általános Építő Korlátolt Felelősségű Társaság,"11705053444,01-09-930940",HUN_1117_Budapest_Gábor Dénes (Infopark D épület) Utca 2.,Nem,,HUF,120000000.0,HUF,Igen,nem ismert ,,Nem,Nem,Nincs adat,11337/2022,,2022-06-02,Tájékoztató az eljárás eredményéről,-2 days,69343,NYÍRVV Nyíregyházi Városüzemeltető és Vagyonkezelő Nonprofit Kft.,STRABAG Általános Építő Korlátolt Felelősségű Társaság
EKR000769992022,,,Őrtilos Község Önkormányzata,15398453114,Nem,Nem,N - Regionális/helyi szintű,KL - Egyéb tevékenység:,Nemzeti eljárásrend,Kbt. 112. § (1) bekezdés b) pont Nyílt eljárás (hirdetménnyel induló),Kerékpárforgalmi út kialakítása Őrtilos térségében,Építési beruházás,491993198.0,HUF,45233162-2,45233290-8|45233221-4|45233162-2|45221110-6,HU232,Igen,Nem,Igen,Igen,Igen,,2022-09-14,4.0,Nem,Colas Út Építőipari Zártkörűen Működő Részvénytársaság,"14904134244,HU14904134",HUN_1113_Budapest_Bocskai Út 73.,Nem,,HUF,491993198.0,HUF,Igen,"Colas Közlekedésépítő Zrt., Székhely 1113 Budapest, Bocskai út 73.,  Adószám 26090575-2-43 ","Colas Közlekedésépítő Zrt., Székhely 1113 Budapest, Bocskai út 73.,  Adószám 26090575-2-43, A felhívás III.1.3) M.2.2. pontja szerinti alkalmassági követelmény",Nem,Nem,Nincs adat,20034/2022,,2022-09-18,Tájékoztató az eljárás eredményéről,-4 days,69400,Őrtilos Község Önkormányzata,Colas Út Építőipari Zártkörűen Működő Részvénytársaság
EKR000866442022,,,Vecsés Város Önkormányzata,15730686213,Nem,Nem,N - Regionális/helyi szintű,KL - Általános közszolgáltatások,Nemzeti eljárásrend,Kbt. 117. § Saját beszerzési szabályok alkalmazása részvételi szakasz nélkül,Külterületi összekötő út építése Vecsésen,Építési beruházás,397454850.0,HUF,45000000-7,45000000-7|45111000-8|45233120-6|45221250-9,HU120,Igen,Nem,Igen,Nem,Igen,,2022-10-27,8.0,Nem,Colas Út Építőipari Zártkörűen Működő Részvénytársaság,"14904134244,HU14904134",HUN_1113_Budapest_Bocskai Út 73.,Nem,828145327.0,HUF,397454850.0,HUF,Igen,-,-,Nem,Nem,Nincs adat,23850/2022,,2022-11-06,Tájékoztató az eljárás eredményéről,-10 days,69722,Vecsés Város Önkormányzata,Colas Út Építőipari Zártkörűen Működő Részvénytársaság
EKR000684112022,,,Gyomaendrőd Város Önkormányzata,15725527204,Nem,Nem,N - Regionális/helyi szintű,KL - Általános közszolgáltatások,Nemzeti eljárásrend,Kbt. 112. § (1) bekezdés b) pont Nyílt eljárás (hirdetménnyel induló),Belterületi vízrendezés Gyomaendrődön X. ütem,Építési beruházás,167441347.0,HUF,45231300-8,45231300-8,HU332,Igen,Nem,Igen,Igen,Igen,,2022-06-16,3.0,Nem,TÖMB 2002 Szolgáltató Korlátolt Felelősségű Társaság,"22757937209,HU22757937",HUN_4220_Hajdúböszörmény_Polgári  Utca 13.,Igen,200393701.0,HUF,167441347.0,HUF,Nem,,,Nem,Nem,Nincs adat,12678/2022,,2022-06-20,Tájékoztató az eljárás eredményéről,-4 days,69797,Gyomaendrőd Város Önkormányzata,TÖMB 2002 Szolgáltató Korlátolt Felelősségű Társaság
EKR000941532022,,,Ostoros Községi Önkormányzat,15728953210,Nem,Nem,N - Regionális/helyi szintű,KL - Egyéb tevékenység:,Nemzeti eljárásrend,Kbt. 117. § Saját beszerzési szabályok alkalmazása részvételi szakasz nélkül,Külterületi helyi közutak fejlesztése,Építési beruházás,52782475.0,HUF,45233142-6,45233223-8|45233228-3|45233222-1|45233220-7|45233142-6|45233229-0,HU312,Igen,Nem,Igen,Igen,Igen,,2022-10-10,9.0,Nem,Colas Út Építőipari Zártkörűen Működő Részvénytársaság,"14904134244,HU14904134",HUN_1113_Budapest_Bocskai Út 73.,Nem,90097158.0,HUF,52782475.0,HUF,Nem,,,Nem,Nem,Nincs adat,22448/2022,,2022-10-14,Tájékoztató az eljárás eredményéről,-4 days,69958,Ostoros Községi Önkormányzat,Colas Út Építőipari Zártkörűen Működő Részvénytársaság
