EKR000597052021,,,Belváros-Lipótváros Budapest Főváros V. kerület Önkormányzat,15735681241,Nem,Nem,U - Regionális vagy helyi hatóság,KL - Általános közszolgáltatások,Uniós eljárásrend,Keretmegállapodás alapján írásbeli konzultáció,„Arany J. u. megújítása I. ütem” ,Építési beruházás,617200740.0,HUF,45200000-9,45200000-9,HU110,Nem,Nem,Igen,Nem,Igen,,2021-07-05,1.0,Nem,Penta Általános Építőipari Korlátolt Felelősségű Társaság,"10452556244,HU10452556",HUN_2100_Gödöllő_Kenyérgyári Út 1/E.,Igen,,HUF,617200740.0,HUF,Igen,Még nem ismert.,,Nem,Nem,Nincs adat,13316/2021,2021/S 136-358786,2021-07-18,Tájékoztató az eljárás eredményéről,-13 days,14275,Belváros-Lipótváros Budapest Főváros V. kerület Önkormányzat,Penta Általános Építőipari Korlátolt Felelősségű Társaság
EKR000612562021,,,BKK Budapesti Közlekedési Központ Zártkörűen Működő Részvénytársaság,23028966444,Nem,Nem,N - Közjogi szervezet,KL - Egyéb tevékenység:,Nemzeti eljárásrend,Kbt. 112. § (1) bekezdés b) pont Nyílt eljárás (hirdetménnyel induló),"Budapest VI. kerület, Podmaniczky utca felújítása",Építési beruházás,297998086.0,HUF,45233120-6,45233120-6|71240000-2|65000000-3|71500000-3|45316213-1|45316200-7,HU110,Igen,Nem,Igen,Nem,Igen,,2021-11-26,3.0,Nem,Penta Általános Építőipari Korlátolt Felelősségű Társaság,"10452556244,HU10452556",HUN_2100_Gödöllő_Kenyérgyári Út 1/E.,Igen,,HUF,297998086.0,HUF,Igen,Az igénybe venni kívánt alvállalkozó az ajánlat benyújtásakor még nem ismert,,Nem,Nem,Nincs adat,23814/2021,,2021-11-30,Tájékoztató az eljárás eredményéről,-4 days,14380,BKK Budapesti Közlekedési Központ Zártkörűen Működő Részvénytársaság,Penta Általános Építőipari Korlátolt Felelősségű Társaság
EKR000636362021,,,Göd Város Önkormányzata,15731106213,Nem,Nem,N - Regionális/helyi szintű,KL - Általános közszolgáltatások,Nemzeti eljárásrend,Kbt. 112. § (1) bekezdés b) pont Nyílt eljárás (hirdetménnyel induló),Keretmegállapodás útépítési és felújítási munkákra,Építési beruházás,500000000.0,HUF,45233120-6,45233120-6,HU120,Igen,Nem,Igen,Nem,Igen,,2021-08-31,2.0,Nem,Penta Általános Építőipari Korlátolt Felelősségű Társaság,"10452556244,HU10452556",HUN_2100_Gödöllő_Kenyérgyári Út 1/E.,Igen,1500000000.0,HUF,500000000.0,HUF,Igen,,Tarjánvölgyi Építőipari Korlátolt Felelősségű Társaság (adószáma: 23382226212) III.1.3) M/1,Igen,Nem,Nincs adat,17236/2021,,2021-09-08,Tájékoztató az eljárás eredményéről,-8 days,14557,Göd Város Önkormányzata,Penta Általános Építőipari Korlátolt Felelősségű Társaság
EKR000695462018,,,Kisbajcs Község Önkormányzata,15366698108,Nem,Nem,N - Regionális/helyi szintű,KL - Általános közszolgáltatások,Nemzeti eljárásrend,Kbt. 115. § Nyílt eljárás,Járdafelújítás Kisbajcson,Építési beruházás,4099911.0,HUF,45233260-9,45233260-9,HU221,Igen,Nem,Igen,Nem,Igen,,2018-10-24,4.0,Nem,STRABAG Általános Építő Korlátolt Felelősségű Társaság,"11705053444,01-09-930940",HUN_1117_Budapest_Gábor Dénes (Infopark D épület) Utca 2.  ,Nem,4201105.0,HUF,4099911.0,HUF,Nem,,,Nem,Nem,Nincs adat,19983/2018,,2018-10-30,Tájékoztató az eljárás eredményéről,-6 days,15205,Kisbajcs Község Önkormányzata,STRABAG Általános Építő Korlátolt Felelősségű Társaság
EKR000845252021,,,Fóti Közszolgáltató Közhasznú Nonprofit Kft.,14539262213,Nem,Nem,N - Regionális/helyi szintű,KL - Általános közszolgáltatások,Nemzeti eljárásrend,Kbt. 115. § Nyílt eljárás,"Fót Város, Malom u. infrastrukturális fejlesztése",Építési beruházás,182714507.0,HUF,45000000-7,45000000-7,HU120,Igen,Nem,Igen,Nem,Igen,,2021-09-09,3.0,Nem,Penta Általános Építőipari Korlátolt Felelősségű Társaság,"10452556244,HU10452556",HUN_2100_Gödöllő_Kenyérgyári Út 1/E.,Igen,,HUF,182714507.0,HUF,Igen,Még nem ismert.,-,Nem,Nem,Nincs adat,17734/2021,,2021-09-13,Tájékoztató az eljárás eredményéről,-4 days,15852,Fóti Közszolgáltató Közhasznú Nonprofit Kft.,Penta Általános Építőipari Korlátolt Felelősségű Társaság
EKR000919472021,,,Nemesborzova Község Önkormányzata,15442710115,Nem,Nem,N - Regionális/helyi szintű,KL - Általános közszolgáltatások,Nemzeti eljárásrend,Kbt. 112. § (1) bekezdés b) pont Nyílt eljárás (hirdetménnyel induló),Nemesborzova - Belterületi csapadékvíz elvezetés,Építési beruházás,39799800.0,HUF,45232130-2,45232130-2,HU323,Igen,Nem,Igen,Igen,Igen,,2022-07-29,5.0,Nem,TÖMB 2002 Szolgáltató Korlátolt Felelősségű Társaság,"22757937209,HU22757937",HUN_4220_Hajdúböszörmény_Polgári  Utca 13.,Igen,,HUF,39799800.0,HUF,Igen,,,Nem,Nem,Nincs adat,16362/2022,,2022-08-02,Tájékoztató az eljárás eredményéről,-4 days,16253,Nemesborzova Község Önkormányzata,TÖMB 2002 Szolgáltató Korlátolt Felelősségű Társaság
EKR000932862021,,,Debrecen Megyei Jogú Város Önkormányzata,15735588209,Nem,Nem,U - Regionális vagy helyi hatóság,KL - Általános közszolgáltatások,Uniós eljárásrend,Nyílt eljárás,"Debrecen, Csárda utca IV. és V. ütem útépítése",Építési beruházás,238960044.0,HUF,45233228-3,45232450-1|45233252-0,HU321,Igen,Nem,Igen,Igen,Igen,,2022-07-04,4.0,Nem,TÖMB 2002 Szolgáltató Korlátolt Felelősségű Társaság,"22757937209,HU22757937",HUN_4220_Hajdúböszörmény_Polgári  Utca 13.,Igen,,HUF,238960044.0,HUF,Igen,"Balczó Sándor e.v., adószám: 44672371224- felelős műszaki vezetői feladatok. Az útépítési munka tekintetében az alvállalkozó még nem ismert.",,Nem,Nem,Nincs adat,14219/2022,2022/S 131-372515,2022-07-11,Tájékoztató az eljárás eredményéről,-7 days,16280,Debrecen Megyei Jogú Város Önkormányzata,TÖMB 2002 Szolgáltató Korlátolt Felelősségű Társaság
EKR000966812021,,,Nyíregyháza Megyei Jogú Város Önkormányzata,15731766215,Nem,Nem,U - Regionális vagy helyi hatóság,KL - Általános közszolgáltatások,Uniós eljárásrend,Nyílt eljárás,Széchenyi utca útburkolat felújítása,Építési beruházás,248200374.0,HUF,45233120-6,45233120-6,HU323,Igen,Nem,Igen,Igen,Igen,,2021-11-22,6.0,Nem,Colas Út Építőipari Zártkörűen Működő Részvénytársaság,"14904134244,HU14904134",HUN_1113_Budapest_Bocskai Út 73.,Nem,277985238.0,HUF,248200374.0,HUF,Igen,nem ismert,nincs,Nem,Nem,Nincs adat,23484/2021,2021/S 232-610214,2021-11-30,Tájékoztató az eljárás eredményéről,-8 days,16390,Nyíregyháza Megyei Jogú Város Önkormányzata,Colas Út Építőipari Zártkörűen Működő Részvénytársaság
EKR000986452021,,,Nyíregyháza Megyei Jogú Város Önkormányzata,15731766215,Nem,Nem,U - Regionális vagy helyi hatóság,KL - Általános közszolgáltatások,Uniós eljárásrend,Nyílt eljárás,"""Rozsrétszőlő bekötőút felújítása""",Építési beruházás,385945774.0,HUF,45000000-7,45113000-2|45111000-8|45112000-5|45111230-9|45247130-0|45233000-9|45233320-8|45247110-4,HU323,Igen,Nem,Igen,Igen,Igen,,2022-03-31,4.0,Nem,Colas Út Építőipari Zártkörűen Működő Részvénytársaság,"14904134244,HU14904134",HUN_1113_Budapest_Bocskai Út 73.,Nem,,HUF,385945774.0,HUF,Igen,A közbeszerzés teljesítésekor igénybe venni kívánt alvállalkozók az ajánlat benyújtásakor még nem ismertek.,,Nem,Nem,Nincs adat,6861/2022,2022/S 071-188262,2022-04-11,Tájékoztató az eljárás eredményéről,-11 days,16468,Nyíregyháza Megyei Jogú Város Önkormányzata,Colas Út Építőipari Zártkörűen Működő Részvénytársaság
EKR000988342021,,,Hajdúböszörmény Város Önkormányzata,15728331209,Nem,Nem,N - Regionális/helyi szintű,KL - Általános közszolgáltatások,Nemzeti eljárásrend,Kbt. 117. § Saját beszerzési szabályok alkalmazása részvételi szakasz nélkül,TOP-1.4.1 Bölcsőde,Építési beruházás,147456000.0,HUF,45210000-2,45200000-9|45210000-2,HU321,Igen,Nem,Igen,Igen,Igen,,2021-12-16,3.0,Nem,TÖMB 2002 Szolgáltató Korlátolt Felelősségű Társaság,"22757937209,HU22757937",HUN_4220_Hajdúböszörmény_Polgári  Utca 13.,Igen,141844719.0,HUF,147456000.0,HUF,Igen,"ARA-TERV Ipari és Szolgáltató Bt. (4031 Debrecen, Ond utca 6.) 22872339-1-09, Ipolyi Plan-Ing 2020 Mérnök Kft. (4032 Debrecen, Görgey utca 2. 8. em. 65.) 27089152-2-09, Zs-Tervezőiroda Kft. (Mikepércs, Szakács Andor utca 2/2.) 26350037-2-09","III.1.3.M2-ARA-TERV Ipari és Szolgáltató Bt.(4031 Debrecen, Ond utca 6.)22872339-1-09,III.1.3.M3-Ipolyi Plan-Ing 2020 Mérnök Kft.(4032 Debrecen,Görgey utca 2. 8. em.65.)27089152-2-09,III.1.3.M4.-Zs-Tervezőiroda Kft.(Mikepércs,Szakács Andor utca 2/2.)26350",Nem,Nem,Nincs adat,25540/2021,,2021-12-20,Tájékoztató az eljárás eredményéről,-4 days,16527,Hajdúböszörmény Város Önkormányzata,TÖMB 2002 Szolgáltató Korlátolt Felelősségű Társaság
EKR001052842021,,,Tiszavasvári Város Önkormányzata,15732468215,Nem,Nem,N - Regionális/helyi szintű,KL - Általános közszolgáltatások,Nemzeti eljárásrend,Kbt. 117. § Saját beszerzési szabályok alkalmazása részvételi szakasz nélkül,Találkozások Háza - megismételt eljárás,Építési beruházás,93360219.0,HUF,45000000-7,45000000-7,HU323,Igen,Nem,Igen,Igen,Igen,,2022-01-27,3.0,Nem,TÖMB 2002 Szolgáltató Korlátolt Felelősségű Társaság,"22757937209,HU22757937",HUN_4220_Hajdúböszörmény_Polgári  Utca 13.,Igen,63875647.0,HUF,93360219.0,HUF,Igen,"Ara-Terv Bt. (székhely: 4031 Debrecen, Ond utca 6., adószám: 22872339-1-09)","Ara-Terv Bt. (székhely: 4031 Debrecen, Ond utca 6., adószám: 22872339-1-09) felelős műszaki vezető, AF III.1.3) M/1.",Nem,Nem,Nincs adat,2020/2022,,2022-01-31,Tájékoztató az eljárás eredményéről,-4 days,16769,Tiszavasvári Város Önkormányzata,TÖMB 2002 Szolgáltató Korlátolt Felelősségű Társaság
EKR000729022018,,,Vámosszabadi Község Önkormányzata,15728290108,Nem,Nem,N - Regionális/helyi szintű,KL - Általános közszolgáltatások,Nemzeti eljárásrend,Kbt. 113. § Nyílt eljárás,Útépítés Vámosszabadi ipari területén,Építési beruházás,63630075.0,HUF,45233000-9,45233000-9,HU221,Igen,Nem,Igen,Igen,Igen,,2019-01-21,4.0,Nem,STRABAG Általános Építő Korlátolt Felelősségű Társaság,"11705053444,01-09-930940",HUN_1117_Budapest_Gábor Dénes (Infopark D épület) Utca 2.  ,Nem,57046370.0,HUF,63630075.0,HUF,Nem,,,Nem,Nem,Nincs adat,1746/2019,,2019-02-11,Tájékoztató az eljárás eredményéről,-21 days,16810,Vámosszabadi Község Önkormányzata,STRABAG Általános Építő Korlátolt Felelősségű Társaság
EKR001077502021,,,Balmazújváros Város Önkormányzata,15728506209,Nem,Nem,N - Regionális/helyi szintű,KL - Általános közszolgáltatások,Nemzeti eljárásrend,Kbt. 112. § (1) bekezdés b) pont Nyílt eljárás (hirdetménnyel induló),Építési beruházás,Építési beruházás,236798100.0,HUF,45200000-9,45200000-9|45213000-3,HU321,Igen,Nem,Igen,Igen,Igen,,2022-05-06,4.0,Nem,TÖMB 2002 Szolgáltató Korlátolt Felelősségű Társaság,"22757937209,HU22757937",HUN_4220_Hajdúböszörmény_Polgári  Utca 13.,Igen,146255523.0,HUF,236798100.0,HUF,Igen,"Ara - Terv Bt. 22872339-1-09,  Ipolyi- Plan - Ing 2020 Kft. 27089152-2-09,  Gész 2000 Kft. 13579193-2-09","Ara - Terv Bt. 22872339 - 1- 09, III.1.3) M1. MV- É felelős műszaki vezetővel való rendelkezés,",Nem,Nem,Nincs adat,10238/2022,,2022-05-26,Tájékoztató az eljárás eredményéről,-20 days,16916,Balmazújváros Város Önkormányzata,TÖMB 2002 Szolgáltató Korlátolt Felelősségű Társaság
EKR001102572021,,,NIF Nemzeti Infrastruktúra Fejlesztő zártkörűen működő Részvénytársaság,11906522241,Nem,Nem,U - Közjogi intézmény,KL - Egyéb tevékenység:,Uniós eljárásrend,Nyílt eljárás,"87-89. számú főút, Szombathely elkerülő szakasz",Építési beruházás,36708859774.0,HUF,45000000-7,71320000-7|45233228-3|45221111-3|45233128-2,HU222,Igen,Nem,Igen,Nem,Igen,,2022-02-01,3.0,Nem,STRABAG Általános Építő Korlátolt Felelősségű Társaság,"11705053444,01-09-930940",HUN_1117_Budapest_Gábor Dénes (Infopark D épület) Utca 2.,Nem,,HUF,36708859774.0,HUF,Igen,"Züblin Építőipari Beruházási és Szolgáltató Korlátolt  Felelősségű Társaság (1117 Budapest, Gábor Dénes utca 2.  (Infopark D épület)10786589-4-43","Züblin Építőipari Beruházási és Szolgáltató Korlátolt Felelősségű Társaság (1117 Budapest, Gábor Dénes utca 2.(Infopark D épület) III.1.1) NY.1), III.1.3) M2.4., 10786589-4-43",Nem,Nem,Nincs adat,2249/2022,2022/S 030-073374,2022-02-10,Tájékoztató az eljárás eredményéről,-9 days,16949,NIF Nemzeti Infrastruktúra Fejlesztő zártkörűen működő Részvénytársaság,STRABAG Általános Építő Korlátolt Felelősségű Társaság
EKR001112892021,,,Vértesacsa Község Önkormányzata,15727086207,Nem,Nem,N - Regionális/helyi szintű,KL - Egyéb tevékenység:,Nemzeti eljárásrend,Kbt. 112. § (1) bekezdés b) pont Nyílt eljárás (hirdetménnyel induló),Vértesacsa 486659 azonosító számú Vis maior,Építési beruházás,54735000.0,HUF,45454100-5,45252124-3,HU211,Igen,Nem,Igen,Nem,Igen,,2021-11-11,2.0,Nem,STRABAG Általános Építő Korlátolt Felelősségű Társaság,"11705053444,01-09-930940",HUN_1117_Budapest_Gábor Dénes (Infopark D épület) Utca 2.,Nem,48730000.0,HUF,54735000.0,HUF,Igen,,,Nem,Nem,Nincs adat,22592/2021,,2021-11-15,Tájékoztató az eljárás eredményéről,-4 days,16974,Vértesacsa Község Önkormányzata,STRABAG Általános Építő Korlátolt Felelősségű Társaság
EKR001155062021,,,Tiszafüred Város Önkormányzata,15733108216,Nem,Nem,N - Regionális/helyi szintű,KL - Általános közszolgáltatások,Nemzeti eljárásrend,Kbt. 112. § (1) bekezdés b) pont Nyílt eljárás (hirdetménnyel induló),Tiszafüred kiállító tereinek fejlesztése,Építési beruházás,82924900.0,HUF,45212300-9,45332200-5|45331100-7|45350000-5|45421130-4|45320000-6|45311200-2|34928500-3|45111100-9|45442110-1|45210000-2|45214000-0|45213316-1|45223300-9,HU322,Igen,Nem,Igen,Igen,Igen,,2022-01-13,3.0,Nem,TÖMB 2002 Szolgáltató Korlátolt Felelősségű Társaság,"22757937209,HU22757937",HUN_4220_Hajdúböszörmény_Polgári  Utca 13.,Igen,79024722.0,HUF,82924900.0,HUF,Igen,"Ara-Terv Betéti Társaság, 22872339-1-09","Ara-Terv Betéti Társaság, 22872339-1-09 III.1.3.) M.2.1.",Nem,Nem,Nincs adat,1146/2022,,2022-01-19,Tájékoztató az eljárás eredményéről,-6 days,17330,Tiszafüred Város Önkormányzata,TÖMB 2002 Szolgáltató Korlátolt Felelősségű Társaság
EKR001366082021,,,Alsóörs Község Önkormányzata|Felsőörs község Önkormányzata,15734013219|15734116219,Igen,Nem,N - Regionális/helyi szintű,KL - Általános közszolgáltatások,Nemzeti eljárásrend,Kbt. 112. § (1) bekezdés b) pont Nyílt eljárás (hirdetménnyel induló),"Alsóörs, kerékpárút építés II. ütem",Építési beruházás,89947050.0,HUF,45233162-2,45233162-2,HU213,Igen,Nem,Igen,Igen,Igen,,2022-04-08,8.0,Nem,Colas Út Építőipari Zártkörűen Működő Részvénytársaság,"14904134244,HU14904134",HUN_1113_Budapest_Bocskai Út 73.,Nem,82167097.0,HUF,89947050.0,HUF,Igen,Ajánlattételkor nem ismert,nem releváns,Nem,Nem,Nincs adat,7560/2022,,2022-04-13,Tájékoztató az eljárás eredményéről,-5 days,18419,Alsóörs Község Önkormányzata|Felsőörs község Önkormányzata,Colas Út Építőipari Zártkörűen Működő Részvénytársaság
EKR001446122021,,,BKK Budapesti Közlekedési Központ Zártkörűen Működő Részvénytársaság,23028966444,Nem,Nem,U - Közjogi intézmény,KL - Egyéb tevékenység:,Uniós eljárásrend,Nyílt eljárás,Budapest XIV. ker. Vezér utca felújítása ,Építési beruházás,817904538.0,HUF,45233120-6,45233120-6|45231400-9|45232210-7|45233140-2|45233290-8|45233221-4|45233228-3|45247130-0,HU110,Igen,Nem,Igen,Nem,Igen,,2022-05-25,5.0,Nem,Colas Út Építőipari Zártkörűen Működő Részvénytársaság,"14904134244,HU14904134",HUN_1113_Budapest_Bocskai Út 73.,Nem,,HUF,817904538.0,HUF,Igen,az ajánlat benyújtásakor nem ismert,,Nem,Nem,Nincs adat,11132/2022,2022/S 108-303928,2022-06-07,Tájékoztató az eljárás eredményéről,-13 days,18756,BKK Budapesti Közlekedési Központ Zártkörűen Működő Részvénytársaság,Colas Út Építőipari Zártkörűen Működő Részvénytársaság
EKR001543812021,,,Esztár Község Önkormányzata,15728829209,Nem,Nem,N - Regionális/helyi szintű,KL - Általános közszolgáltatások,Nemzeti eljárásrend,Kbt. 117. § Saját beszerzési szabályok alkalmazása részvételi szakasz nélkül,Belterületi vízrendezés Esztár községben,Építési beruházás,78999169.0,HUF,45232452-5,45232410-9,HU321,Igen,Nem,Igen,Igen,Igen,,2022-05-10,9.0,Nem,TÖMB 2002 Szolgáltató Korlátolt Felelősségű Társaság,"22757937209,HU22757937",HUN_4220_Hajdúböszörmény_Polgári  Utca 13.,Igen,111102207.0,HUF,78999169.0,HUF,Igen,Balczó Sándor e.v. ( 5540 Szarvas Malom utca 17.1.a.) 44672371-2-24,,Nem,Nem,Nincs adat,9891/2022,,2022-05-15,Tájékoztató az eljárás eredményéről,-5 days,19267,Esztár Község Önkormányzata,TÖMB 2002 Szolgáltató Korlátolt Felelősségű Társaság
EKR000780872018,,,Szegedi Környezetgazdálkodási Nonprofit Kft.,18455058206,Nem,Nem,U - Egyéb típus:,KL - Általános közszolgáltatások,Nemzeti eljárásrend,Kbt. 115. § Nyílt eljárás,Útkarbantartás,Építési beruházás,299999999.0,HUF,45233141-9,45233142-6,HU333,Igen,Nem,Igen,Nem,Igen,,2018-11-12,4.0,Nem,Colas Út Építőipari Zártkörűen Működő Részvénytársaság,"14904134244,HU14904134",HUN_1113_Budapest_Bocskai Út 73. ,Nem,299999999.0,HUF,299999999.0,HUF,Igen,Nem ismert,,Nem,Nem,Nincs adat,21265/2018,,2018-11-19,Tájékoztató az eljárás eredményéről,-7 days,19451,Szegedi Környezetgazdálkodási Nonprofit Kft.,Colas Út Építőipari Zártkörűen Működő Részvénytársaság
EKR001610712021,,,Esztergom Város Önkormányzat,15729600211,Nem,Nem,N - Regionális/helyi szintű,KL - Általános közszolgáltatások,Nemzeti eljárásrend,Kbt. 115. § Nyílt eljárás,Útfelújítások - keretszerződés,Építési beruházás,299990000.0,HUF,45233142-6,45233140-2|45233142-6|45233141-9|45233320-8|45233220-7,HU212,Igen,Nem,Igen,Nem,Igen,,2022-04-06,2.0,Nem,STRABAG Általános Építő Korlátolt Felelősségű Társaság,"11705053444,01-09-930940",HUN_1117_Budapest_Gábor Dénes (Infopark D épület) Utca 2.,Nem,299990000.0,HUF,299990000.0,HUF,Nem,,,Nem,Nem,Nincs adat,7184/2022,,2022-04-12,Tájékoztató az eljárás eredményéről,-6 days,19582,Esztergom Város Önkormányzat,STRABAG Általános Építő Korlátolt Felelősségű Társaság
EKR001656802021,,,Társadalmi Infrastruktúra Fejlesztő Nonprofit Korlátolt Felelősségű Társaság,18549878242,Nem,Nem,N - Közjogi szervezet,KL - Egyéb tevékenység:,Nemzeti eljárásrend,Kbt. 115. § Nyílt eljárás,"Gólyafészek Otthon, Karcag - kivitelezés",Építési beruházás,59876800.0,HUF,45000000-7,45000000-7|45261410-1|45421131-1,HU322,Igen,Nem,Igen,Nem,Igen,,2021-12-28,2.0,Nem,TÖMB 2002 Szolgáltató Korlátolt Felelősségű Társaság,"22757937209,HU22757937",HUN_4220_Hajdúböszörmény_Polgári  Utca 13.,Igen,36219407.0,HUF,59876800.0,HUF,Igen,,,Nem,Nem,Nincs adat,26666/2021,,2022-01-05,Tájékoztató az eljárás eredményéről,-8 days,19805,Társadalmi Infrastruktúra Fejlesztő Nonprofit Korlátolt Felelősségű Társaság,TÖMB 2002 Szolgáltató Korlátolt Felelősségű Társaság
EKR001749632021,,,Komádi Városi Önkormányzat,15728458209,Nem,Nem,N - Regionális/helyi szintű,KL - Általános közszolgáltatások,Nemzeti eljárásrend,Kbt. 115. § Nyílt eljárás,Fő u. 81.szám(1916 hrsz.)közösségi tér kivitelezés,Építési beruházás,72047100.0,HUF,45210000-2,45210000-2,HU321,Igen,Nem,Igen,Nem,Igen,,2022-01-18,3.0,Nem,TÖMB 2002 Szolgáltató Korlátolt Felelősségű Társaság,"22757937209,HU22757937",HUN_4220_Hajdúböszörmény_Polgári  Utca 13.,Igen,72047100.0,HUF,72047100.0,HUF,Igen,"Ara-Terv Bt. (4031 Debrecen, Ond utca 6.) 22872339-1-09",,Nem,Nem,Nincs adat,1310/2022,,2022-01-19,Tájékoztató az eljárás eredményéről,-1 days,20237,Komádi Városi Önkormányzat,TÖMB 2002 Szolgáltató Korlátolt Felelősségű Társaság
EKR000033402022,2,"Épület felújítási, karbantartási munkák II.",Békés Megyei Kormányhivatal,15789264204,Nem,Nem,N - Regionális/helyi szintű,KL - Egyéb tevékenység:,Nemzeti eljárásrend,Kbt. 115. § Nyílt eljárás,"BÉMKH épületeinek felújítási, karbantartási munkái",Építési beruházás,89837496.0,HUF,45453100-8,45400000-1|45210000-2|45300000-0|45453100-8,HU332,Igen,Nem,Igen,Nem,Igen,,2022-03-16,5.0,Nem,TÖMB 2002 Szolgáltató Korlátolt Felelősségű Társaság,"22757937209,HU22757937",HUN_4220_Hajdúböszörmény_Polgári  Utca 13.,Igen,,HUF,29945832.0,HUF,Nem,,,Nem,Nem,Nincs adat,5418/2022,,2022-03-21,Tájékoztató az eljárás eredményéről,-5 days,20422,Békés Megyei Kormányhivatal,TÖMB 2002 Szolgáltató Korlátolt Felelősségű Társaság
EKR000033402022,3,"Épület felújítási, karbantartási munkák III.",Békés Megyei Kormányhivatal,15789264204,Nem,Nem,N - Regionális/helyi szintű,KL - Egyéb tevékenység:,Nemzeti eljárásrend,Kbt. 115. § Nyílt eljárás,"BÉMKH épületeinek felújítási, karbantartási munkái",Építési beruházás,89837496.0,HUF,45453100-8,45453100-8|45300000-0|45400000-1|45210000-2,HU332,Igen,Nem,Igen,Nem,Igen,,2022-03-16,5.0,Nem,TÖMB 2002 Szolgáltató Korlátolt Felelősségű Társaság,"22757937209,HU22757937",HUN_4220_Hajdúböszörmény_Polgári  Utca 13.,Igen,,HUF,29945832.0,HUF,Nem,,,Nem,Nem,Nincs adat,5418/2022,,2022-03-21,Tájékoztató az eljárás eredményéről,-5 days,20423,Békés Megyei Kormányhivatal,TÖMB 2002 Szolgáltató Korlátolt Felelősségű Társaság
EKR000071172022,2,2. régió  ,Magyar Posta Zártkörűen Működő Részvénytársaság,10901232244,Nem,Nem,,KO - Postai szolgáltatások,Uniós eljárásrend,Nyílt eljárás,Épített mobil indítópontok kialakítása II.,Építési beruházás,249750007.0,HUF,45211350-7,45211350-7,HU321|HU332|HU331|HU333,Igen,Nem,Igen,Nem,Igen,,2022-07-22,4.0,Nem,TÖMB 2002 Szolgáltató Korlátolt Felelősségű Társaság,"22757937209,HU22757937",HUN_4220_Hajdúböszörmény_Polgári  Utca 13.,Igen,,HUF,249750007.0,HUF,Igen,"ARA-TERV Ipari és Szolgáltató Betéti Társaság (4031 M.2.1. Debrecen, Ond utca 6., adószáma: 22872339-2-09)","ARA-TERV Ipari és Szolgáltató Betéti Társaság (4031 M.2.1. Debrecen, Ond utca 6., adószáma: 22872339-2-09), III.1.3.) M.2.1.",Nem,Nem,Nincs adat,15922/2022,2022/S 146-419103,2022-08-01,Tájékoztató az eljárás eredményéről,-10 days,20557,Magyar Posta Zártkörűen Működő Részvénytársaság,TÖMB 2002 Szolgáltató Korlátolt Felelősségű Társaság
EKR000116912022,,,Derecske Város Önkormányzata,15728427209,Nem,Nem,N - Regionális/helyi szintű,KL - Általános közszolgáltatások,Nemzeti eljárásrend,Kbt. 115. § Nyílt eljárás,Derecske belterületi utak építése ,Építési beruházás,123509000.0,HUF,45233228-3,45233252-0|45221250-9,HU321,Igen,Nem,Igen,Nem,Igen,,2022-05-17,2.0,Nem,TÖMB 2002 Szolgáltató Korlátolt Felelősségű Társaság,"22757937209,HU22757937",HUN_4220_Hajdúböszörmény_Polgári  Utca 13.,Igen,109390706.0,HUF,123509000.0,HUF,Igen,"Balczó Sándor egyéni vállalkozó, 44672371-2-24",,Nem,Nem,Nincs adat,10280/2022,,2022-05-18,Tájékoztató az eljárás eredményéről,-1 days,20834,Derecske Város Önkormányzata,TÖMB 2002 Szolgáltató Korlátolt Felelősségű Társaság
EKR000223092022,,,Jászárokszállás Város Önkormányzata,15732846216,Nem,Nem,N - Regionális/helyi szintű,KL - Általános közszolgáltatások,Nemzeti eljárásrend,Kbt. 112. § (1) bekezdés b) pont Nyílt eljárás (hirdetménnyel induló),Jászárokszállási külterületi út fejlesztése       ,Építési beruházás,207468988.0,HUF,45233228-3,45233123-7|45233228-3,HU322,Igen,Nem,Igen,Igen,Igen,,2022-08-11,12.0,Nem,Colas Út Építőipari Zártkörűen Működő Részvénytársaság,"14904134244,HU14904134",HUN_1113_Budapest_Bocskai Út 73.,Nem,226506907.0,HUF,207468988.0,HUF,Igen,-,-,Nem,Nem,Nincs adat,17490/2022,,2022-08-16,Tájékoztató az eljárás eredményéről,-5 days,21080,Jászárokszállás Város Önkormányzata,Colas Út Építőipari Zártkörűen Működő Részvénytársaság
EKR000827052018,,,"Velencei-tó és Térsége, Váli-völgy, Vértes Térségi Fejlesztési Tanács",18491139107,Nem,Nem,U - Egyéb típus:,KL - Egyéb tevékenység:,Nemzeti eljárásrend,Kbt. 115. § Nyílt eljárás,Etyek Alsó út Gasztrosétány ,Építési beruházás,118094192.0,HUF,45221250-9,45112000-5,HU211,Igen,Nem,Igen,Nem,Igen,,2018-12-04,4.0,Nem,ÚTÉPPARK Útépítő és Mélyépítő Kft.,"24105099207,24105099",HUN_8000_Székesfehérvár_Sóstói Út 7 ,Igen,110229510.0,HUF,118094192.0,HUF,Igen,Nem ismert,,Nem,Nem,Nincs adat,23126/2018,,2018-12-13,Tájékoztató az eljárás eredményéről,-9 days,21165,"Velencei-tó és Térsége, Váli-völgy, Vértes Térségi Fejlesztési Tanács",ÚTÉPPARK Útépítő és Mélyépítő Kft.
